{"content_fingerprint_sha256":"58e285d6355b08af8b439027f2b6423950aaa057b905bf90237b8e74b1291236","conversation_id":"chatgpt-finans-sistemini-gelistirme-8d7dc213bc86","conversation_title":"Göymen ERP — Finans Sistemini Geliştirme","counts":{"attachments":87,"conflicts":1,"items":97},"coverage":"visible_only","files":[{"bytes":6606,"path":"KNOWLEDGE.md","sha256":"014521b5577776da87b51fab38d7ee8d6b4713044499a1b85ea217a56d2f1418"},{"bytes":64558,"path":"NORMALIZED_ITEMS.ndjson","sha256":"58e285d6355b08af8b439027f2b6423950aaa057b905bf90237b8e74b1291236"},{"bytes":1911,"path":"CONFLICT_CANDIDATES.md","sha256":"b6d715d6194cc20df3f3ca07cbf00fd9a4b9beea9b5fb5f189f9337c8c5836eb"},{"bytes":13682,"path":"ATTACHMENT_INDEX.md","sha256":"d7fbf676dd2702ef3654963854635733cc6491666aa2da4c9944863410e1ac26"},{"bytes":3536,"path":"EXPORT_REPORT.md","sha256":"da09ab09b28fe591ff48021f6fa3702ddcee52bd897604a6f3abed7c1266a19f"}],"inaccessible":["Platform-native verbatim conversation export was unavailable; source messages were recovered from the user-visible transcript archived in this session.","Some earlier File Library/source documents cited in assistant answers were not directly accessible as current attachments; only project meaning visible in the conversation was normalized.","The full Goymen_ERP_Finans_Calisma_Alani_v2 HTML/source/ZIP was unavailable; only archived v2 preview images were accessible."],"privacy_review":{"pii_review":"passed","redactions":0,"secret_scan":"passed"},"provider":"chatgpt","run_id":"GOYMENERP-KNOWLEDGE-V4-01","schema_version":"1.0","source_id":"chatgpt-finans-sistemini-gelistirme-76891388a894","source_snapshot_sha256":"76891388a894d617acd4dfbe29c55bbda9564ed197014c7dfb6fc1fcf83dac62","status":"partial"}
