{
  "content_fingerprint_sha256": "e41ee03f4037c38d3e8fc5e8937f8f1a7bcb41aa2e6ce1221bb5d29bb5b58eb3",
  "conversation_id": "chatgpt-goymenerp-autonomous-cari-thread",
  "conversation_title": "GöymenERP otonom üç-ajan geliştirme ve Cari teslimi",
  "counts": {
    "attachments": 1,
    "conflicts": 1,
    "items": 42
  },
  "coverage": "partial",
  "files": [
    {
      "bytes": 9438,
      "path": "KNOWLEDGE.md",
      "sha256": "bfcada6a01d68c41c8c87657638255c7ea0aec6662be924bc362ead7d0379e3e"
    },
    {
      "bytes": 31839,
      "path": "NORMALIZED_ITEMS.ndjson",
      "sha256": "e41ee03f4037c38d3e8fc5e8937f8f1a7bcb41aa2e6ce1221bb5d29bb5b58eb3"
    },
    {
      "bytes": 1110,
      "path": "CONFLICT_CANDIDATES.md",
      "sha256": "82d7e0fe56a1530a0bca7271412c1309f66689577eae59f15f6a3546b3d66ae7"
    },
    {
      "bytes": 766,
      "path": "ATTACHMENT_INDEX.md",
      "sha256": "6460269e0bc56127c21865f02bcbc0fe81e35ca618c1f77e218f6b912928ed46"
    },
    {
      "bytes": 4147,
      "path": "EXPORT_REPORT.md",
      "sha256": "57c6fa01dad025a4aeac32a2e9f1c7eacc0ab31ec12b7900a5d56d81a616d464"
    }
  ],
  "inaccessible": [
    "Earlier conversation turns represented only as 'Skipped N messages' in the active model context; raw message bodies were unavailable.",
    "Earlier uploaded images/documents/archives referenced by prior turns were not mounted or byte-accessible in this run.",
    "No platform transcript-export or stable conversation-id API was available; conversation_id was deterministically derived from visible project context."
  ],
  "privacy_review": {
    "pii_review": "passed",
    "redactions": 3,
    "secret_scan": "passed"
  },
  "provider": "chatgpt",
  "run_id": "GOYMENERP-KNOWLEDGE-V4-01",
  "schema_version": "1.0",
  "source_id": "chatgpt-goymenerp-otonom-uc-ajan-cari-teslimi-5864cddec534",
  "source_snapshot_sha256": "5864cddec53445b46ed30dff002ab9c9dc0a6f605a775833bdf113834df6bbca",
  "status": "partial"
}
