{
  "schema_version": "1.0",
  "run_id": "GOYMENERP-KNOWLEDGE-V4-01",
  "provider": "chatgpt",
  "source_id": "chatgpt-alt-menuleri-tasarla-c813643335af",
  "conversation_id": "chatgpt-alt-menuleri-tasarla-e78c95efc7f74669",
  "conversation_title": "Alt Menüleri Tasarla",
  "coverage": "visible_only",
  "inaccessible": [
    "Kullanıcının tasarım/rengi için referans verdiği 'Şirket içi ChatGPT kullanımı' adlı ayrı GöymenERP konuşması bu kaynak aktarımında görünür değildir; yalnız bu konuşmadaki referans talimatı işlenmiştir."
  ],
  "status": "complete",
  "privacy_review": {
    "secret_scan": "passed",
    "pii_review": "passed",
    "redactions": 4
  },
  "source_snapshot_sha256": "c813643335af2dca44a44706c89509303652b0888c43c30d7a70adc908d78a29",
  "content_fingerprint_sha256": "cda3daada5abafbeeabc0c5006b2d038db5c6c487d724694b4bcbd1c3259b82c",
  "files": [
    {
      "path": "KNOWLEDGE.md",
      "bytes": 7943,
      "sha256": "d3fef483483e8c464c9076f1fb2c6797cf1556d1fbaf3e6e0fb773ab52359748"
    },
    {
      "path": "NORMALIZED_ITEMS.ndjson",
      "bytes": 24367,
      "sha256": "cda3daada5abafbeeabc0c5006b2d038db5c6c487d724694b4bcbd1c3259b82c"
    },
    {
      "path": "CONFLICT_CANDIDATES.md",
      "bytes": 1680,
      "sha256": "10770e2432f7e649daf00488cfabb7f6545ed0da680ea6588f07742c3da972e8"
    },
    {
      "path": "ATTACHMENT_INDEX.md",
      "bytes": 9684,
      "sha256": "8d5f7220eeaa87e9697321bf9c97107887f3bd856134e4b814b005a8ef882fdf"
    },
    {
      "path": "EXPORT_REPORT.md",
      "bytes": 4333,
      "sha256": "d72f51b4903591aa57319319f6c5f6803e78da9bf63ea3c32fcc0e3d85c7b322"
    }
  ],
  "counts": {
    "items": 31,
    "attachments": 38,
    "conflicts": 0
  }
}
